Question Type,Question Text,Explanation,Score Points,Test Cases JSON
Coding Question,"Write a function to add two numbers","The function should take two parameters and return their sum. Example: add(2, 3) should return 5",10,"[{""input"":""2, 3"",""expectedOutput"":""5"",""explanation"":""2 + 3 = 5""},{""input"":""10, 20"",""expectedOutput"":""30"",""explanation"":""10 + 20 = 30""},{""input"":""-5, 5"",""expectedOutput"":""0"",""explanation"":""-5 + 5 = 0""}]"
Coding Question,"Write a function to check if a number is even","The function should return true if the number is even, false otherwise. A number is even if it's divisible by 2",5,"[{""input"":""4"",""expectedOutput"":""true"",""explanation"":""4 is divisible by 2""},{""input"":""7"",""expectedOutput"":""false"",""explanation"":""7 is not divisible by 2""},{""input"":""0"",""expectedOutput"":""true"",""explanation"":""0 is considered even""}]"
Coding Question,"Write a function to find the maximum of two numbers","The function should compare two numbers and return the larger one. If equal, return either",8,"[{""input"":""5, 10"",""expectedOutput"":""10"",""explanation"":""10 is greater than 5""},{""input"":""15, 8"",""expectedOutput"":""15"",""explanation"":""15 is greater than 8""},{""input"":""7, 7"",""expectedOutput"":""7"",""explanation"":""Both numbers are equal""}]"
Coding Question,"Write a function to reverse a string","The function should take a string as input and return the reversed string. Example: reverse('hello') should return 'olleh'",12,"[{""input"":""hello"",""expectedOutput"":""olleh"",""explanation"":""Reverse of hello is olleh""},{""input"":""world"",""expectedOutput"":""dlrow"",""explanation"":""Reverse of world is dlrow""},{""input"":""a"",""expectedOutput"":""a"",""explanation"":""Single character remains same""}]"
Coding Question,"Write a function to calculate factorial","The function should calculate the factorial of a non-negative integer. Factorial of n is n! = n × (n-1) × (n-2) × ... × 1",15,"[{""input"":""5"",""expectedOutput"":""120"",""explanation"":""5! = 5 × 4 × 3 × 2 × 1 = 120""},{""input"":""3"",""expectedOutput"":""6"",""explanation"":""3! = 3 × 2 × 1 = 6""},{""input"":""0"",""expectedOutput"":""1"",""explanation"":""0! is defined as 1""}]"
